{
  "$schema": "./../tooling/registry/schemas/authored-pattern.schema.json",
  "name": "change-password",
  "description": "Use this pattern to present a change-password modal with current password, new password, password requirement validation, confirmation validation, and save or cancel actions.",
  "keywords": [
    "authentication",
    "change password",
    "password requirements",
    "modal",
    "account settings",
    "validation"
  ],
  "preview": "react-patterns/dist/ix/change-password",
  "variants": {
    "react": {
      "files": [
        {
          "sourcePath": "react-patterns/src/routes/change-password/change-password.tsx"
        },
        {
          "sourcePath": "react-patterns/src/routes/change-password/change-password.module.css"
        }
      ]
    },
    "angular": {
      "files": [
        {
          "sourcePath": "angular-standalone-patterns/src/routes/change-password/change-password.ts"
        },
        {
          "sourcePath": "angular-standalone-patterns/src/routes/change-password/change-password.html"
        },
        {
          "sourcePath": "angular-standalone-patterns/src/routes/change-password/change-password.css"
        }
      ]
    }
  }
}
